{
  "schema": "covenant.payment-intent.v1",
  "protocol": {
    "name": "x402",
    "version": 2,
    "scheme": "exact",
    "accepted_sha256": "sha256:29b617135032d52687ac97ccdb263ef14da4a0f7e264f23338c99ab2b7828781",
    "payment_identifier": "pay_7d5d747be160e280504c099d984bcfe0"
  },
  "request": {
    "url": "https://provider.example/resource?format=json",
    "method": "POST",
    "body_sha256": "sha256:e3b0c44298fc1c149afbf4c8996fb92427ae41e4649b934ca495991b7852b855"
  },
  "payment": {
    "network": "solana:5eykt4UsFv8P8NJdTREpY1vzqKqZKvdp",
    "funder": "9VaDVp1Wb78G4Wm6VuTiMrpESjrUymXefQTHcJGRSTEA",
    "fee_payer": "2wKupLR9q6wXYppw8Gr2NvWxKBUqm4PPJKkQfoxHDBg4",
    "mint": "EPjFWdd5AufqSSqeM2qN1xzybapC8G4wEGGkZwyTDt1v",
    "token_program": "TokenkegQfeZyiNwAJbNbGKPFXCWuBvf9Ss623VQ5DA",
    "required_amount": "80000",
    "transfer_amount": "80000",
    "decimals": 6,
    "pay_to": "7G73PLhKvAPBGTzG5ESAE4coE7QrVeTTKfhTxQZbyGgC",
    "source_ata": "5SvmwUbZCqWGi4VdgPryvk7FDUPRzHY4AaXoS4w83h3k",
    "destination_ata": "FaZxn8A41KgRZmm8vLrt4aZNVTDtRBBYS37FjCEKpXBs",
    "memo": "pay_7d5d747be160e280504c099d984bcfe0",
    "compute_unit_limit": 20000,
    "compute_unit_price_micro_lamports": 1,
    "transaction_profile": "sponsored_v0_static_v1"
  },
  "observed_at_ms": 1785456000000,
  "expires_at_ms": 1785456060000
}
